{
  "schema": "srwf-kor.acceptance-receipt.v1",
  "releaseId": "srwf-f-20260928-v0-5-b",
  "state": "ACCEPTED",
  "acceptedAt": "2026-09-28T22:04:20+09:00",
  "stockProfileId": "saturn-jp-stock-track01-mode1-2352-c198a930",
  "sourceSha256": "c198a93007d46161abe769b6f579f01cae89e23737c0a2ff38ec314d43b3adf8",
  "targetSha256": "85b9cbf349c421d621f3a6e6819d94f9ee1405137430046469562a2176e798a3",
  "patchSha256": "0a49422528c142bd24cbbf975fdcfb4f09f059069e5025e48e81ad8efae70345",
  "v5Commit": "ea1076d778df77815a4ac448ac2a21ec3d7ace8b",
  "gates": {
    "staticStructure": "PASS",
    "runtimeConsumption": "PASS",
    "visualLayout": "PASS",
    "longPlayProgression": "NOT_CLAIMED"
  },
  "decisionAuthority": "사용자 2026-09-28 지시: G103/r116 abc 로컬 패치·다운로드 목록 등록. 기존 복사 상태 검증 범위로 수용. 신규 콜드부트·a/b 개별 플레이·장기 진행·CD-R 검수는 주장하지 않음. 원격 배포 제외."
}
