{
  "schema": "srwf-kor.acceptance-receipt.v1",
  "releaseId": "srwf-f-20260810-preview",
  "state": "ACCEPTED",
  "acceptedAt": "2026-08-09T15:55:36Z",
  "stockProfileId": "saturn-jp-stock-track01-mode1-2352-c198a930",
  "sourceSha256": "c198a93007d46161abe769b6f579f01cae89e23737c0a2ff38ec314d43b3adf8",
  "targetSha256": "2dc6168afca91daccb6ac48a3473dd6969831c152e91535c47448579da29a26a",
  "patchSha256": "718ac1042dbb4c5a104b1088ddcd937d9608a44367fd7b8e7eeaf3bb0beb4d61",
  "v5Commit": "db6b57af028882ae0e7a3afd0305906f836e33d0",
  "gates": {
    "staticStructure": "PASS",
    "runtimeConsumption": "PASS",
    "visualLayout": "PASS",
    "longPlayProgression": "PASS"
  },
  "decisionAuthority": "저장소 소유자 지시: 2026.08.10 이전 프리뷰 공개, 알려진 마이너 표시·문구 문제 수용"
}
