{
  "schema": "srwf-kor.acceptance-receipt.v1",
  "releaseId": "srwf-final-20260921-v0-1-c",
  "state": "ACCEPTED",
  "acceptedAt": "2026-09-21T00:00:00+09:00",
  "stockProfileId": "saturn-jp-stock-track01-mode1-2352-ff7192ab",
  "sourceSha256": "ff7192abc112d5c969a0e236f5061fc6853234eedc350525c46c0548c57dfbdb",
  "targetSha256": "b6ddb95cb6c8a053106a5e169ad8d366d73f070a184465e031ca94054a6424df",
  "patchSha256": "d5c9ccd47072a8794115095c93fb9bff57e3f9bd5d029baacda0a26d251e402b",
  "v5Commit": "0781ed99537c6d72762a7efc426653eb6ff3d4ee",
  "gates": {
    "staticStructure": "PASS",
    "runtimeConsumption": "PASS",
    "visualLayout": "PASS",
    "longPlayProgression": "NOT_CLAIMED"
  },
  "decisionAuthority": "사용자 지시: r109 후속 최신 리비전 r110 a/b/c를 F 완결편 v0.1로 로컬 등록하고 원격 배포. r110 방어 이펙트 중복 호출 수정 반영. fresh coldboot·장기 진행은 별도 미청구."
}
