{
  "schema": "srwf-kor.acceptance-receipt.v1",
  "releaseId": "srwf-f-20260812-v1-1",
  "state": "ACCEPTED",
  "acceptedAt": "2026-08-11T23:27:58Z",
  "stockProfileId": "saturn-jp-stock-track01-mode1-2352-c198a930",
  "sourceSha256": "c198a93007d46161abe769b6f579f01cae89e23737c0a2ff38ec314d43b3adf8",
  "targetSha256": "4319df1a1feb7c2608568884348bf9078cc7e954679bae9aafcad7784f4ecbb3",
  "patchSha256": "a8cca9b2c1afb53cd762bb3670a9381e0c2ad2695f2c90c23103442e4f5460a8",
  "v5Commit": "9de93aa4a2b0ebb1ef0dcd589740ed801c1a2f34",
  "gates": {
    "staticStructure": "PASS",
    "runtimeConsumption": "PASS",
    "visualLayout": "PASS",
    "longPlayProgression": "PASS"
  },
  "decisionAuthority": "저장소 소유자 지시: 2026.08.12 공개 패치를 v1.1 기본 선택 항목으로 제공하도록 승인"
}
